<?xml version="1.0" encoding="UTF-8"?>
<branches xmlns="http://example.org/branches" xmlns:xsi="http://www.w3.org/2001/XMLSchema-instance" xsi:schemaLocation="http://example.org/branches branches.xsd">
	<branch>
		<location>Downtown SF</location>
		<hours>
			<Weekday>
				<closeTime>22:00:00</closeTime>
			</Weekday>
			<Saturday>
				<closeTime>14:00:00</closeTime>
			</Saturday>
			<Sunday>
				<closeTime>23:59:59</closeTime>
			</Sunday>
		</hours>
	</branch>
	<branch>
		<location>SFO</location>
		<hours>
			<Weekday>
				<closeTime>23:00:00</closeTime>
			</Weekday>
			<Saturday>
				<closeTime>23:00:00</closeTime>
			</Saturday>
			<Sunday>
				<closeTime>21:00:00</closeTime>
			</Sunday>
		</hours>
	</branch>
</branches>
